{
    "$schema": "http://json-schema.org/draft-07/schema#",
    "title": "NvidiaInfo terminus",
    "version": "1.0.0",
    "description": "Schema for nvidia-info per-terminus JSON files (e.g. ProcessorModule_0_Info.json). The `version` field is informational; it is not enforced against producer JSON.",
    "type": "object",
    "properties": {
        "Processor": {
            "type": "array",
            "items": { "$ref": "#/$defs/Processor" }
        },
        "Memory": {
            "type": "array",
            "items": { "$ref": "#/$defs/Memory" }
        },
        "PCIeSlots": {
            "type": "array",
            "items": { "$ref": "#/$defs/PCIeSlot" }
        },
        "TPM": {
            "type": "array",
            "items": { "$ref": "#/$defs/TPM" }
        }
    },
    "required": ["Processor", "Memory", "PCIeSlots"],
    "$defs": {
        "Processor": {
            "type": "object",
            "properties": {
                "Socket": {
                    "description": "Socket index for the processor (0-255)",
                    "type": "integer",
                    "minimum": 0,
                    "maximum": 255
                },
                "Family": {
                    "description": "Processor family (e.g., ARMv9)",
                    "type": "string",
                    "minLength": 1
                },
                "Manufacturer": {
                    "description": "Processor manufacturer name",
                    "type": "string",
                    "minLength": 1
                },
                "Id": {
                    "description": "Processor ID as a 64-bit value in hexadecimal: 1–16 hex digits, optional leading 0x or 0X (e.g. 0x036b0410 or 036b0410).",
                    "type": "string",
                    "pattern": "^(0[xX])?[0-9a-fA-F]{1,16}$"
                },
                "Version": {
                    "description": "Processor version string (e.g., Vera B01)",
                    "type": "string",
                    "minLength": 1
                },
                "MaxSpeedInMhz": {
                    "description": "Maximum processor speed in MHz (PoR Max frequency, must be > 0)",
                    "type": "integer",
                    "minimum": 1
                },
                "SerialNumber": {
                    "description": "Processor serial number (ECID from bl params)",
                    "type": "string",
                    "minLength": 1
                },
                "PartNumber": {
                    "description": "Processor part number from FRU",
                    "type": "string",
                    "minLength": 1
                },
                "CoreCount": {
                    "description": "Number of processor cores (must be > 0)",
                    "type": "integer",
                    "minimum": 1
                },
                "ThreadCount": {
                    "description": "Number of processor threads (must be > 0)",
                    "type": "integer",
                    "minimum": 1
                },
                "Model": {
                    "description": "Processor model name (e.g., Vera)",
                    "type": "string",
                    "minLength": 1
                },
                "ModelRevision": {
                    "description": "Processor model revision (e.g., B01)",
                    "type": "string",
                    "minLength": 1
                },
                "SKU": {
                    "description": "Processor SKU identifier",
                    "type": "string",
                    "minLength": 1
                }
            },
            "required": [
                "Socket",
                "Family",
                "Manufacturer",
                "Id",
                "Version",
                "MaxSpeedInMhz",
                "SerialNumber",
                "CoreCount",
                "ThreadCount",
                "Model",
                "ModelRevision",
                "SKU"
            ]
        },
        "Memory": {
            "type": "object",
            "properties": {
                "Present": {
                    "description": "Whether the memory device is present.",
                    "type": "boolean"
                },
                "MemoryTotalWidth": {
                    "description": "Total width of the memory device in bits (must be > 0)",
                    "type": "integer",
                    "minimum": 1
                },
                "MemoryDataWidth": {
                    "description": "Data width of the memory device in bits (must be > 0)",
                    "type": "integer",
                    "minimum": 1
                },
                "MemorySizeKB": {
                    "description": "Size of the memory device in kilobytes (must be > 0)",
                    "type": "integer",
                    "minimum": 1
                },
                "FormFactor": {
                    "description": "Physical form factor of the memory device.",
                    "$comment": "Allow-list: the `enum` array is the complete set of accepted FormFactor strings.",
                    "type": "string",
                    "enum": [
                        "RDIMM",
                        "UDIMM",
                        "SO_DIMM",
                        "LRDIMM",
                        "Mini_RDIMM",
                        "Mini_UDIMM",
                        "SO_RDIMM_72b",
                        "SO_UDIMM_72b",
                        "SO_DIMM_16b",
                        "SO_DIMM_32b",
                        "Die",
                        "SOCAMM"
                    ]
                },
                "MemoryDeviceLocator": {
                    "description": "Location of the memory device (e.g., LP5x_0)",
                    "type": "string",
                    "minLength": 1
                },
                "MemoryType": {
                    "description": "Memory device type; must be one of the allowed DeviceType values.",
                    "type": "string",
                    "enum": [
                        "DDR", "DDR2", "DDR3", "DDR4", "DDR4E-SDRAM",
                        "DDR5", "LPDDR5-SDRAM", "LPDDR4-SDRAM",
                        "LPDDR3-SDRAM", "DDR2-SDRAM-FB-DIMM",
                        "DDR2-SDRAM-FB-DIMM-PROBE", "DDR-SGRAM",
                        "ROM", "SDRAM", "EDO", "FastPageMode",
                        "PipelinedNibble", "Logical", "HBM", "HBM2", "HBM3"
                    ]
                },
                "MaxMemorySpeedInMHz": {
                    "description": "Maximum memory speed in MHz (must be > 0)",
                    "type": "integer",
                    "minimum": 1
                },
                "Manufacturer": {
                    "description": "Memory manufacturer name",
                    "type": "string",
                    "minLength": 1
                },
                "SerialNumber": {
                    "description": "Memory device serial number",
                    "type": "string",
                    "minLength": 1
                },
                "SKU": {
                    "description": "Memory device SKU identifier",
                    "type": "string",
                    "minLength": 1
                },
                "PartNumber": {
                    "description": "Memory device part number",
                    "type": "string",
                    "minLength": 1
                },
                "MemoryConfiguredSpeedInMhz": {
                    "description": "Configured memory speed in MHz (must be > 0)",
                    "type": "integer",
                    "minimum": 1
                },
                "Model": {
                    "description": "Memory device model name",
                    "type": "string",
                    "minLength": 1
                },
                "ECC": {
                    "description": "Whether ECC is supported",
                    "type": "boolean"
                },
                "MemoryMedia": {
                    "description": "Memory media type; must be one of the allowed literals (case-sensitive in JSON).",
                    "type": "string",
                    "enum": ["DRAM", "NAND", "Intel3DXPoint"]
                },
                "ProcessorModuleIndex": {
                    "description": "Processor module index this memory belongs to (0-9)",
                    "type": "integer",
                    "minimum": 0,
                    "maximum": 9
                }
            },
            "required": [
                "Present",
                "MemoryDeviceLocator",
                "ProcessorModuleIndex"
            ]
        },
        "PCIeSlot": {
            "type": "object",
            "properties": {
                "Present": {
                    "description": "Whether the PCIe slot is present.",
                    "type": "boolean"
                },
                "Generation": {
                    "description": "PCIe generation number (0=unknown, 1-6 = Gen1-Gen6)",
                    "type": "integer",
                    "minimum": 0,
                    "maximum": 6
                },
                "HotPluggable": {
                    "description": "Whether the slot supports hot-plugging",
                    "type": "boolean"
                },
                "SlotType": {
                    "description": "Physical slot type (e.g., CEM, U2, None)",
                    "type": "string",
                    "minLength": 1
                },
                "MaxLinkSpeed": {
                    "description": "Maximum link speed generation number (0-6)",
                    "type": "integer",
                    "minimum": 0,
                    "maximum": 6
                },
                "MaxLinkWidth": {
                    "description": "Maximum number of PCIe lanes (0-64)",
                    "type": "integer",
                    "minimum": 0,
                    "maximum": 64
                },
                "Lanes": {
                    "description": "Number of active PCIe lanes (0-64)",
                    "type": "integer",
                    "minimum": 0,
                    "maximum": 64
                },
                "ProcessorModuleIndex": {
                    "description": "Processor module index this slot belongs to (0-9)",
                    "type": "integer",
                    "minimum": 0,
                    "maximum": 9
                },
                "SegmentControllerIndex": {
                    "description": "Segment controller (UPHY) index (must be >= 0)",
                    "type": "integer",
                    "minimum": 0
                },
                "PortType": {
                    "description": "Port type (e.g., Bi-directional, None)",
                    "type": "string",
                    "minLength": 1
                },
                "PortProtocol": {
                    "description": "Port protocol (e.g., PCIe, CXL, NVCHI, None)",
                    "type": "string",
                    "minLength": 1
                },
                "RootPort": {
                    "description": "Root port index within the segment controller (must be >= 0)",
                    "type": "integer",
                    "minimum": 0
                },
                "LocationCode": {
                    "description": "Physical lane location code (e.g., UPHY0:0-16)",
                    "type": "string",
                    "minLength": 1
                }
            },
            "required": [
                "Present",
                "Generation",
                "HotPluggable",
                "SlotType",
                "MaxLinkSpeed",
                "MaxLinkWidth",
                "Lanes",
                "ProcessorModuleIndex",
                "SegmentControllerIndex",
                "PortType",
                "PortProtocol",
                "RootPort",
                "LocationCode"
            ]
        },
        "TPM": {
            "type": "object",
            "properties": {
                "Manufacturer": {
                    "description": "TPM vendor/manufacturer ID",
                    "type": "string",
                    "minLength": 1
                },
                "MajorSpecVersion": {
                    "description": "TPM major specification version",
                    "type": "string",
                    "minLength": 1
                },
                "Version": {
                    "description": "TPM firmware version",
                    "type": "string",
                    "minLength": 1
                }
            },
            "required": [
                "Manufacturer",
                "MajorSpecVersion",
                "Version"
            ]
        }
    }
}
